[
  {
    "budget_exhausted": false,
    "candidates": 1782,
    "disciplines": [
      "osint_web",
      "osint_feed",
      "osint_site"
    ],
    "finished_at": "2026-10-06T21:57:40.334560Z",
    "funnel": {
      "dropped_negative": 9,
      "dropped_own": 120,
      "dropped_unrelated": 212,
      "new": 1764,
      "passed": 1960,
      "raw": 2301,
      "reinforcements": 18,
      "seen_before": 0,
      "unique": 1782
    },
    "instrument_version": "2026.10.0",
    "promoted": 60,
    "request_budget": 150,
    "requests_made": 139,
    "run_id": "20261006T2155Z-6ae7",
    "started_at": "2026-10-06T21:55:22.431740Z",
    "status": "complete",
    "submissions": [
      "20261006T2155Z-6ae7__1"
    ],
    "undisposed": 0
  }
]
